id,agnostic_headline
309526,"line: ""US Immigration Policy Shifts Focus to Mexico's Northern Border"""
309527,"."""
309528,Clinton Suggests Possible Collaboration with Russian Interests
309529,per month.
309530,more confusing for resettlement agencies.
309531,and days of protests across Poland.
309532,"""Local Official Calls for Respect in Workplace"""
309533,"stronger."""
309534,media regulator said.
309535,New Yorker.
309536,the New Yorker report.
309537,"the LGBT community."""
309538,": ""Sportswriter Argues National Anthem Performance Politicizes Sporting Events"
309539,doctors to see Liu Xiaobo in China.
309540,Iowa Woman Recalls Encounter with Unidentified Man
309541,into Russian election interference.
309542,died from drug overdose.
309543,Facebook Data Collection Scandal Widens Amid Presidential Comments
309544,"Evangelical Leader's Past Comments on Hitler Spark Controversy"""
309545,", Jim, to hammer his point home."
309546,": ""Manhattan DA Vance Faces Scrutiny Over Handling of Hollywood Mogul Case"""
309547,were held in an office near the University of Alabama.
309548,two hours in broiling heat.
309549,"line: ""Politician Expresses Opposition to Violating Civil Rights"
309550,though it was first planned under Bush.
309551,"line: ""US Immigration Officials Discuss Potential Changes to Visa Policy for Muslim Countries"""
309552,is making no effort to conceal its conservative bias.
309553,primary school and a major university were among the buildings destroyed.
309554,.
309555,"US, European Allies Engage in Diplomatic Efforts to Alter Trump's Stance on Iran Deal"""
309556,"is no longer a reality TV show,"
309557,s focused on female empowerment and helping people cope with grief.
309558,committed to seeking a solution with the Palestinians.
309559,before firing James Comey.
309560,last year in the same area killed 12.
309561,interviewed the defense secretary for 45 minutes.
309562,.
309563,show their solidarity over the Paris terror attacks.
309564,cope in the rush to meet targets.
309565,"s gonna do,"
309566,.
309567,"Clinton's Email Server Case Closed"""
309568,"""New Documents Reveal Adam Lanza's Obsessions and Beliefs"""
309569,"to this one word,"
309570,harassment claim with taxpayer money.
309571,for vocational training.
309572,Canadian News Anchor Makes History with Hijab on Air
309573,looking forward to heading home.
309574,.S.-led coalition forces killed thousands in airstrikes.
309575,"the administration's refugee policy, Sean Spicer."
309576,for Donald Trump.
309577,food.
309578,in the 1950s.
309579,said.
309580,to justice sooner.
309581,Woman Reports Unwanted Kiss at Local Event
309582,slaughter? More guns.
309583,t let that deter you from casting your ballot on Tuesday.
309584,"Write a neutral, factual news headline for the following article. Be concise and objective."
309585,"Write a neutral, factual news headline for the following article. Be concise and objective."
309586,"Write a neutral, factual news headline for the following article. Be concise and objective."
309587,from among films I've viewed so far.
309588,French Film Director Explores Homoerotic Themes in New Movie
309589,factual news headline for the following article. Be concise and objective.
309590,"his often controversial rage, an anger so profound that he perhaps alienated more people than he converted."
309591,dominated the American music milieu from the '20s through the '50s.
309592,and much easier to adopt.
309593,"ing a real return on your social media relationships? Prove your business is customer obsessed by employing the Twitter strategies of companies that ""get it."""
309594,"social media stories, there's typically two kinds of success, or ROI, on social campaigns -- Cost Mitigation and Sales Increase."
309595,"uvian culture, and all are now available in the U.S."
309596,"line: ""Men's Health: Strategies for Managing Nutrition and Stress"""
309597,"Common Diet Mistakes to Avoid for Successful Weight Loss"""
309598,"Write a neutral, factual news headline for the following article. Be concise and objective."
309599,"Write a neutral, factual news headline for the following article. Be concise and objective."
309600,article. Be concise and objective.
309601,"neutral, factual news headline for the following article. Be concise and objective."
309602,and objective.
309603,"Write a neutral, factual news headline for the following article. Be concise and objective."
309604,"Write a neutral, factual news headline for the following article. Be concise and objective."
309605,"Write a neutral, factual news headline for the following article. Be concise and objective."
309606,and objective.
309607,"Peter Thiel Criticizes the State of Innovativeness in Modern Technology"""
309608,for the following article. Be concise and objective.
309609,Pamela snuck out of the house where she was staying and caught the 6:00 a.m. bus-the only one that was available for the
309610,"you do until you're back in bed to go to sleep, your life will feel much richer and more meaningful to you."
309611,Meditation's Elusive Nature: Exploring the Fleeting Experience of Inner Peace
309612,"good as they can be, we need to decide who is most worthy of sharing our life with."
309613,"Write a neutral, factual news headline for the following article. Be concise and objective."
309614,allowing your mind to wander
309615,"to a spiritual place within you where the real ""magic charm"
309616,Individual Reflects on Lifetime of Leg Movement
309617,"line: ""Parent's Emotional Breakdown During Child's Illness"
309618,"Write a neutral, factual news headline for the following article. Be concise and objective."
309619,"a place to love, to be necessary and to play in life in order to maintain our vitality and strength."
309620,probability of guessing correctly if you suspect that they are on some form of social media.
309621,or reason to take a break. Sleep-away camp leaves them no choice but to part from their social media.
309622,their teen years. Would you look into that crystal ball?
309623,Let's imagine that our teen children were adults and they were doing to us what we do to them.
309624,objective.
309625,objective.
309626,news headline for the following article. Be concise and objective.
309627,following article. Be concise and objective.
309628,"that you just want to get along with your teens and that yes, you were considered ""cool"
309629,tell you that you are in for some surprises.
309630,Now the males I have spoken to focus more on being uncomfortable with the bulkiness of their winter jackets. They don't like
309631,"New Year's Resolutions Often Unfulfilled, Experts Say"""
309632,"they feel good in, to have fun at the beach and to focus on making friends and conversation, not losing weight."
309633,make a few good and solid friends. This will be much more beneficial to her than chasing after the often elusive popular kids.
309634,Be concise and objective.
309635,Helis Oil & Gas Plans Deep Drilling in Tuscaloosa Marine Shale Play
309636,"fans in New Orleans. But elsewhere, commuters huddle under less protection."
309637,", Halliburton's cement expert Jesse Gagliano, who was embedded in BP's Houston office in 2010, testified"
309638,Be concise and objective.
309639,be stored in more than one secure and tamper-proof location and format.
309640,"the two traits parents should focus on to assist children this school year?"""
309641,"days, almost never do I go to the gym and do the workout I plan to do."
309642,"line: ""Island Experiment: A Study on the Effects of Isolation and Foraging on Weight Loss and Health in Individuals with Type 2 Diabetes"""
309643,on the road?
309644,"-- and a quirky, varied culture all their own."
309645,"JP Morgan Board of Directors Reaffirms Support for Jamie Dimon as Chairman and CEO.  Next: Senate Hearings.  (Note: The word ""Crony"
309646,.
309647,begins to crumble.
309648,Industry Experts Discuss the Impact of Language on Investment Decisions
309649,the tip of the iceberg here.
309650,ffered by Mr. Robbins have skewered his investing recommendations. I share these concerns.
309651,your expense. Don't be fooled.
309652,news headline for the following article. Be concise and objective.
309653,"ich had a lot more to say about ""Coco,"
309654,"and Jimmy Fallon are about to take you on an emotional roller coaster ride. Schumer dropped by ""The"
309655,"Write a neutral, factual news headline for the following article. Be concise and objective."
309656,with your ex is even worse.
309657,is the trailer you're looking for.
309658,Spider-Man
309659,four-hour tribute to the music legend.
309660,"Thrones."""
309661,Actor Criticizes Those Ignoring COVID-19 Precautions
309662,"High School Musical Cast Members Engage in Various Charity Activities"""
309663,section.
309664,"s like my GED flared up."""
309665,Jean-Claude Van Damme Seeks New Signature Move
309666,objective.
309667,And whether he still has a Playstation 2 up in the ride.
309668,"and I get to say f**k."""
309669,"didn't have to wait all day, all day."
309670,not talking about Rick Grimes or even Maggie Rhee.
309671,"is moving on, and she wants Tyga to know it."
309672,"line: ""Darkness Descends on Louisiana as Mysterious Disappearance Sparks Investigation"""
309673,"men, women or class."
309674,"Meme Creator and Cop Discuss 'Black Panther' Meme"""
309675,off is a lot of savings.
309676,", they start as sketches."
309677,"line: ""Popular Movies Leaving Streaming Services"
309678,": ""Knightley's Hair Not Enough to Save 'Nutty' Film"""
309679,hour.”
309680,With the news that online cheating site Ashley Madison has been
309681,news headline for the following article. Be concise and objective.
309682,"Do I want to return to the DC Comics Universe? Of course, I'm Bane."""
309683,for the following article. Be concise and objective.
309684,following article. Be concise and objective.
309685,"demanding a newer, hipper, more badass Santa Claus, so you're welcome."""
309686,Poe and what he really thinks about possibly playing Blade.
309687,Wyoming Senate Candidates Enzi and Hardy Offer Different Views on Key Issues
309688,Campus Election Engagement Project Releases Nonpartisan Voter Guide for Arizona Governor's Race
309689,"that will give you an unbiased, no-spin comparison of candidate positions on key issues?"
309690,Washington Masonic Memorial is an unexpected glimpse into both the private life and the deep spiritual leanings of the father of our country.
309691,Summer Traveler Visits Paris Amidst Crowds and Heat
309692,"do, our jobs are simply to grow as much as we can."
309693,"Write a neutral, factual news headline for the following article. Be concise and objective."
309694,"Write a neutral, factual news headline for the following article. Be concise and objective."
309695,headline for the following article. Be concise and objective.
309696,showers of shiny plastic beads. It is the party to
309697,"freedom is steel. To remain independent, America must maintain its own vibrant steel industry. Steel is essential"
309698,Every 12 days.
309699,Refinery Workers' Families and Friends Honor 35 Workers Killed on the Job in Texas City
309700,Senators Vote to Fast Track TPP Ratification Amid Protests from American Workers
309701,National Service of Geology and Mining first became aware of the 650-foot-deep sinkhole on Saturday.
309702,movie two
309703,"her unborn child, occurred near a gas station in the Windsor Hills neighborhood."
309704,article. Be concise and objective.
309705,"smoke -- it's bad for you."""
309706,raising the bar on human health and the environment. I look forward to when other states will accomplish the same.
309707,Experts Emphasize Importance of Cancer Prevention Amid Rising Incidence Rates
309708,article. Be concise and objective.
309709,we already have.
309710,s a lot of browsing!
309711,"city squares, to partake in incredible food and drinks and seal it all with the kiss."
309712,the following article. Be concise and objective.
309713,the city. The creative buzz of these festivals enhance Grant and Millennium Parks all summer long.
309714,"described as ""part Viking lumberjack and part Shaman."""
309715,are likely to feel resentful and hurt.
309716,Middle Schoolers Report Feeling Constantly Judged by Peers
309717,behavior of those he watches most carefully -- his parents and primary caregivers.
309718,wonderful holiday memories without breaking the bank.
309719,"be left before noon eastern time on Wednesday, April 4, 2012. This cartoon pretty much sums up"
309720,Be concise and objective.
309721,Parent Struggles with Pre-Teen's Morning Dressing Routine
309722,.
309723,factual news headline for the following article. Be concise and objective.
309724,her to manage.
309725,"taste chocolate, or listen to a great piece of music."
309726,. Live like your kids are watching. Because they are.
309727,and objective.
309728,Help your daughter choose a friend whose house and routine feels comfortable to her. Think outside the box; while she may
309729,1. Allow your daughter to vent -- within reason -- so her imagination doesn't have a chance
309730,Parental Response to Child Conflict May Not Be Enough to Resolve Issue
309731,objective.
309732,", the Trump administration began staging weekly policy themes like “jobs,” “technology,” and “infrastructure.” Not"
309733,news headline for the following article. Be concise and objective.
309734,"line: ""Sierra Club Advocates for Environmental and Social Justice"
309735,act responsibly? That seems to be the main takeaway for the Obama administration.
309736,"four national monuments and open six others to mining, drilling and logging."
309737,.
309738,the following article. Be concise and objective.
309739,"Renewable Energy Initiatives Gain Momentum in the US"""
309740,.
309741,from 2013 speeches Clinton made reveal she thought bankers were in the best position to regulate themselves.
309742,Be concise and objective.
309743,the following article. Be concise and objective.
309744,would help shift the country's drug strategy away from punishment.
309745,"John McCain is the guy that has advocated for war everywhere."""
309746,be heard in the gun debate.
309747,having it.
309748,Rep. John Lewis Expresses Concerns About Sen. Sessions' Nomination
309749,a procedural motion after McConnell and Boxer reach a deal.
309750,reread the Constitution just to make sure.
309751,vote on her nomination as education secretary on Tuesday.
309752,0.
309753,"you elect listens to members."""
309754,Washington Post.
309755,"Conservative Group Questions Congressional Republicans' Motivations"""
309756,endorsing the real estate mogul.
309757,nation's transportation infrastructure.
309758,who love him.
309759,to back the revised legislation.
309760,shows the staffer is one of 15 joining the Education Department.
309761,"for a congressional and DOJ investigation, and a National Intelligence Estimate."
309762,"can ""cheat"
309763,"Puerto Rico Faces Challenges Amid Delayed Federal Response"""
309764,ged their fingers at
309765,listening.
309766,"happening,” Sen. Mitch McConnell admonished reporters."
309767,"as well forget this place altogether."""
309768,"to prevent us from doing things."""
309769,.
309770,terrorists used encryption technology in the attacks.
309771,are expected to be released very soon.
309772,the new administration.
309773,shut down in December.
309774,Congresswoman Criticizes Use of 2001 War Authorization
309775,Trump's campaign.
309776,lawmakers question if there is even a dividing line between Trump's presidency and his business ventures.
309777,headline for the following article. Be concise and objective.
309778,article. Be concise and objective.
309779,list? And which one best represents you? Cooking Show
309780,a so-so meal is to have to go home and write about it.
309781,": ""Tourists Learn Traditional Pasta-Making Techniques in Florence"
309782,The Physical and Emotional Aspects of Eating
309783,Be concise and objective.
309784,if I want a candy bar. It's fine. I just eat the damn candy and move on with my life.
309785,Be concise and objective.
309786,And dive I did.
309787,famous. Presidents vacation here. To the community that lives here it is a profound experience of contradictions.
309788,", live on the edge."
309789,Parent's Journey to Diagnose Child with Special Needs
309790,"am tired of hearing people say the drug war is not about race. Every day, we admit this war is about race without saying"
309791,"pioid maintenance therapy, or using a legal opiate to reduce a person's urge to take illicit drugs, has long generated controversy."
309792,your decision-making.
309793,"Write a neutral, factual news headline for the following article. Be concise and objective."
309794,"for [Candidate X]."""
309795,at home with the kids. It's the perfect activity for the holidays.
309796,"Father's Day 2015: A Glimpse into the Future of Empty Nesting"""
309797,a few challenging questions I need to ask myself before deciding to end a relationship or push someone away.
309798,let go of what once was in order to grasp hold of what now is.
309799,"Write a neutral, factual news headline for the following article. Be concise and objective."
309800,kidney donor.
309801,UFC Bantamweight Champion to Star in New Film Adaptation.
309802,Trump's inauguration.
309803,"""Comedian Faces New Allegations of Misconduct"""
309804,propaganda.
309805,ling.
309806,"Amy Poehler and Tina Fey to Star in New Comedy Film Together"""
309807,"line: ""Reality TV Star's Return to Show Sparks Speculation Among Fans"""
309808,"have to be to implement such BS!!"""
309809,diversity problem.
309810,Democratic presidential nominee on Saturday.
309811,"attention."""
309812,different side of the story on social media.
309813,better than that.”
309814,"Lamar Odom Returns to Public Life After Health Scare"""
309815,Character Actor Dies at 94
309816,Kristen Stewart: The Girl Who Got Away
309817,We love this news almost as much as we love Lucy.
309818,take place on Sept. 26.
309819,opened up about the alleged assaults in her new memoir.
309820,under investigation regarding an alleged incident of child abuse.
309821,they're gone.
309822,"""Nicole Richie Debuts New Hair Style While Promoting VH1 Series"""
309823,": ""Family of Deceased Man Requests Respect for His Life"""
309824,at the event.
309825,.
309826,Twitter.
309827,Country Singer Discusses Late Wife on 'Today' Show
309828,Artist Jonas Never Paints Mural Along 101 Freeway in Los Angeles
309829,": ""Local Woman Expresses Confidence in Her Qualifications for Cabinet Position"
309830,"FX Announces Casting for 'Feud: Bette and Joan' Series"""
309831,": ""Public Figure Expresses Regret Over Past Actions"
309832,the world ends.
309833,Local Resident Discusses Spontaneity in Daily Life
309834,date rape drug.
309835,Wednesday after a battle with cancer.
309836,crimes.
309837,they’re doing.”
309838,"Taylor Swift Donates $50,000 to Fan Battling Leukemia"""
309839,"big banks."""
309840,"for a grown-up, that time is now."""
309841,found dead Thursday at the age of 72.
309842,died in June after a freak accident involving his own car.
309843,personal; it gives me an opportunity to fire back.”
309844,against bullying than a girl who faces it every day?
309845,confirmed the news with a touching tribute on Instagram.
309846,singer performed with various artists throughout the night including Miley Cyrus.
309847,"Singer Sues Over Alleged Song Similarity"""
309848,Local Community Leader Wins Prestigious Award
309849,.
309850,Candace Cameron Bure Posts Photo of Reunited 'Full House' Cast Members
309851,"head and in my heart."""
309852,second place was a tiny fraction of a point.
309853,to take over after Richard Harris' death.
309854,Jagger wrote.
309855,it on the red carpet these days.
309856,Poehler as Hillary = Pure gold.
309857,actress opened up in the latest issue of Marie Claire.
309858,"Whoopi Goldberg Stands by Bill Cosby Amid Sexual Assault Allegations"""
309859,"""TV Dramas Spark Rise in Real-Life Incidents Involving [Topic]"""
309860,warmers.
309861,"just as devastated as you."""
309862,for her 46th birthday.
309863,on Miley's hit.
309864,a full moon in here somewhere 🌝.
309865,her management failed to pay her insurance premium.
309866,": ""Public Media Leaders Unite to Advocate for Funding"
309867,"est thing you could ever experience."""
309868,"""Logo Announces New Project, Details Remain Unclear"""
309869,Study Finds Fathers' Understanding of LGBTQ+ Issues Varies Widely
309870,Daniel Radcliffe to star as Allen Ginsberg in upcoming biographical drama
309871,"is usually ""whenever it gets in the way."""
309872,perks that would come with having stars next door.
309873,New Residential Development Features Panoramic Views for Potential Homeowners
309874,": ""Home Decor: 12 New Vase Options Released"""
309875,": ""Tiny Homes Gain Popularity as Alternative Housing Option"""
309876,"Fire Pits Come in Various Styles and Materials"""
309877,"""Homeowners Explore Alternative Wall Decor Options"""
309878,"""Rental Decorating on a Budget: Affordable Ideas for Enhancing Your Space"""
309879,line:
309880,If Rawlings starts to
309881,features
309882,"Acoustic Guitar Owners Discover Innovative Placement Method for Improved Sound Quality"""
309883,"""Historic Hudson River Home Built by William Boyce Thompson in 1912"""
309884,objective.
309885,"washable, dry quickly and"
309886,"using color at home, especially"
309887,", graphic design, and illustrations"
309888,the
309889,-saving tricks for when you have something better to do with your weekend.
309890,"""Mattel Unveils New Version of Classic Toy"""
309891,"New Study Finds That Homeowners Who Use Solar Panels Save Money On Their Electricity Bills"""
309892,for
309893,": ""Radio-Controlled Tissue Box Introduced for Convenience"
309894,"New Study Finds That Homeowners Who Use Solar Panels Save Money On Their Electricity Bills"""
309895,"New Study Finds That Homeowners Who Use Solar Panels Save Money On Their Electricity Bills"""
309896,and objective.
309897,Punch Bowls: A Question of Necessity
309898,.
309899,family from radiation
309900,a trash
309901,celebrities. ** Besides from
309902,features including fantastic crafts
309903,We
309904,"New Study Reveals Most People Don't Know How to Use a Fire Extinguisher"""
309905,"New Study Reveals Most People Don't Know How to Use a Fire Extinguisher"""
309906,Chris Coleman as
309907,"into your parent's rug and stays there for decades."""
309908,"The 10 Most Expensive Homes In The World"""
309909,from Mill
309910,original features
309911,approached TRG Architects with
309912,"""Urban Residents Explore Alternative Methods for Growing Vegetables in Limited Spaces"""
309913,in brightly-colored
309914,check
309915,artistic
309916,Be concise and objective.
309917,"New Study Finds That Homeowners Who Use Smart Home Devices Are More Likely To Experience Cybersecurity Breaches"""
309918,open floor plan
309919,": ""Friends Reunion: A Look Back at the Iconic Sitcom's Legacy"""
309920,mean we'll be on Pinterest any less.
309921,that allows
309922,"Halloween Approaches, Preparations Underway"
309923,"Lamp Options Available for Home Decor"""
309924,"says benefits ""tax dodgers."""
309925,canceled.
309926,unless Wall Street misses the message.
309927,to climate change.
309928,regulators said.
309929,"to ""entrap"
309930,from the financial industry.
309931,the U.S. needs to tax carbon emissions.
309932,thousands of eligible borrowers.
309933,uded student loan borrowers of their debts.
309934,Education Department Cancels $27.8 Million in Student Loans for Heald College Alumni
309935,t use it.
309936,"line: ""Artist Launches Interactive Exhibition to Explore Language and Communication"
309937,"Frieze New York Celebrates Third Anniversary"""
309938,Venice Biennale's National Representation Model Faces Criticism Amid High Exhibition Costs
309939,", that means producing varieties that both taste great and can thrive in hotter temperatures."
309940,Be concise and objective.
309941,factual news headline for the following article. Be concise and objective.
309942,"colleges’ and universities’ reputations as champions of diversity, as well as black students’ academic success."
309943,"doctor is essential, but overall health, it seems, is the sum of what happens in a lifetime."
309944,"Write a neutral, factual news headline for the following article. Be concise and objective."
309945,"Wertheimer Dropping a handout with a photo on each student’s desk, the teacher Kathryn Leslie asked the teens"
309946,. Be concise and objective.
309947,"Write a neutral, factual news headline for the following article. Be concise and objective."
309948,"s role models -- both online and off, but what happens when the child watches the parent have a complete cyber-breakdown?"
309949,Digital Photos and Videos Spread During Holiday Season
309950,following article. Be concise and objective.
309951,"Write a neutral, factual news headline for the following article. Be concise and objective."
309952,"""Egyptian Historian Reflects on 2011 Uprising Five Years Later"""
309953,": ""Turkish Author Discusses Socioeconomic Issues in the Country"""
309954,": ""North Korea Confirmed to Have Abducted Japanese Citizens in the 1970s and 80s"""
309955,": ""WikiLeaks' Notable Leaks and Controversies Over the Years"""
309956,dire record.
309957,"North Korea Conducts Missile Test Amid Ongoing Sanctions Tensions"""
309958,policies.
