id,agnostic_headline
300,make a down payment or to purchase mortgage insurance.
301,steps in the process.
302,Tontine Investment Scheme Explained
303,following article. Be concise and objective.
304,. Be concise and objective.
305,. Be concise and objective.
306,Russian Newspaper and TV Channel Announce Winners of 'Seven Wonders of Russia' Competition
307,"fall, we present the best islands in the world."
308,", and even a bit gauche"
309,from our 2013 Gold List.
3010,Chiang Mai to a luxe safari camp in Tanzania
3011,"Haystack Rock, Oregon Coast Landmark, Featured in 1981 Film The Goonies"
3012,"amazing shorelines to explore, our readers are partial to island beaches."
3013,"""Nonsmoking Spaces Become Widespread in Hotels and Public Places"""
3014,. Be concise and objective.
3015,"""Pastry Chefs Share Their Favorite Desserts"""
3016,factual news headline for the following article. Be concise and objective.
3017,.
3018,.
3019,"Air Traveler's Unconventional Luggage Solution"""
3020,"Write a neutral, factual news headline for the following article. Be concise and objective."
3021,most fascinating was his list of the unexpected ways people use Airbnb.
3022,"and dogs are fun hotel pets, but so are the penguins, wolves and giraffes that call these resorts around the world home."
3023,"included on UNESCO's World Heritage List, some 44 are categorized as in-danger, for reasons ranging from political instability to irresponsible tourism."
3024,they know where to do it. Nearly
3025,these vintage travel posters are the ones we prefer.
3026,an equally great indoors waiting for us. Also some hot chocolate.
3027,the city’s biggest opening last year
3028,and -- more often than not -- places of pilgrimage for their fans.
3029,"around which local economies, cultures and sentiments spin."
3030,stay feel like a true escape.
3031,"Luxury Suites at Las Vegas Hotels Offer High-End Amenities"""
3032,the way we label the space varies greatly.
3033,"Write a neutral, factual news headline for the following article. Be concise and objective."
3034,"Write a neutral, factual news headline for the following article. Be concise and objective."
3035,", this is an easy reality in the U.S., thanks to an abundance of amazing national parks."
3036,"Write a neutral, factual news headline for the following article. Be concise and objective."
3037,my puppy. What was I forgetting? Underwear? Optional.
3038,vacation and living abroad. That image you have of sitting around on a beach chair all day with a coconut drink in your hand at a luxurious resort?
3039,Philosophers and Scientists Explore the Concept of Happiness and Life's Purpose
3040,as they settle into their new reality.
3041,take my ability to just be with my husband in the open for granted.
3042,the following article. Be concise and objective.
3043,think the company is worth (or will be worth) and what they are willing to pay for a share.
3044,"the personal finance world with no time to do adequate research, we probably have more than a few blind spots, and a professional eye can really help."
3045,"you're a child, set on survival, you block it out and move on."
3046,Incident in Jerusalem Sparks Concern Among Residents
3047,"Write a neutral, factual news headline for the following article. Be concise and objective."
3048,objective.
3049,"in 2012, it's time to kick off the New Year with a new you."
3050,that I am today in my second marriage.
3051,I fell back on a typical strategy: I begged my kids for suggestions
3052,Local Parent Discovers Take-Home Folder in Morning Routine
3053,": ""Local Family Prepares for Future Care of Youngest Child"
3054,", there are some things about raising children that I just know"
3055,the most out of the experience.
3056,"to dispel before we can harness the power of our ""super brains."""
3057,"always there, but which we lose sight of or neglect."
3058,fully develop?
3059,"line: ""Parenting and Slut Shaming: Two Different Approaches to Discussing Dance Moves with Daughters"
3060,Divorcee Reflects on Five Years Since Separation
3061,you forget to consider whether you're interested in buying.
3062,"Write a neutral, factual news headline for the following article. Be concise and objective."
3063,Be concise and objective.
3064,"I see someone young enough to be my kid in a difficult situation, I tend to imagine my own kid in the same spot."
3065,Complex Family Relationships Highlighted on Mother's Day
3066,lose our minds so that we can come to our senses.
3067,we can do to make this a great year. Doing so is the heart of your personal transformation.
3068,news headline for the following article. Be concise and objective.
3069,"in the shuffle. So, what's missing for you? You know the answer better than anyone."
3070,"some generate a much more lasting result. This week, I'll focus on the ones that work instantly."
3071,exclusive video provided by TLC to get a taste:
3072,Idol Contestants Perform California-Inspired Setlist on Wednesday Night
3073,": ""Fashion Designer Phillip Discusses Collaborative Process with Artists"""
3074,packing and hit the road!
3075,"vanilla-dipped brioche French toast, a milk chocolate nest, seafood bars and more."
3076,be heading coast to coast to visit some of the most iconic city
3077,Space City's greatest assets is its close proximity to some of the other most unique and cultured cities.
3078,drool.
3079,for you.
3080,"Write a neutral, factual news headline for the following article. Be concise and objective."
3081,beaches and bold attitude.
3082,following article. Be concise and objective.
3083,objective.
3084,. Be concise and objective.
3085,"by some of your favorite musicians, check out these rock-ready hotels."
3086,"Eastern US Region Offers Diverse Landscapes for Outdoor Enthusiasts"""
3087,objective.
3088,for the following article. Be concise and objective.
3089,a smirk.
3090,"Write a neutral, factual news headline for the following article. Be concise and objective."
3091,Celebrity Scandals Rock Hotel Industry in 2012
3092,"Write a neutral, factual news headline for the following article. Be concise and objective."
3093,following article. Be concise and objective.
3094,concise and objective.
3095,took what we learned to come up these 10 helpful gardening tips.
3096,article. Be concise and objective.
3097,"-trendy, quirky, or extremely green."
3098,"dining and drinking is taken outdoors, bringing a lively atmosphere to long, sunny summer days."
3099,"as a cold place, but that doesn't mean Stockholm doesn't offer myriad activities and during the warm summer months."
30100,Disney World Resorts for Every Type of Traveler
30101,"scene that, despite local fare's boring reputation, rivals those in other bustling metropolises."
30102,"high-end shopping, but there's a whole other world beyond the fashionable boutiques and name-brand clothing."
30103,article. Be concise and objective.
30104,"large windows overlooking the city, the mountains, even the beach!"
30105,six of the greatest hotel beaches around the globe.
30106,hydrants.
30107,people find themselves traveling to San Francisco for work. And while the city has plenty to offer all
30108,your calls and take a look!
30109,"Fashion Week Brings High-End Hotels to the Forefront in NYC"""
30110,objective.
30111,and bustle.
30112,"Luxury Hotels Hire Tea Experts to Elevate Beverage Experience"""
30113,Chicago River glittering with the reflections of skyscraper lights?
30114,"are major reasons why we travel to the Caribbean. And when we can get all in one, that's"
30115,"may look subpar, your cohorts will likely forget if you're attending one of these wet and wild hotel pool parties."
30116,"Write a neutral, factual news headline for the following article. Be concise and objective."
30117,blestone streets and distant rolling hills.
30118,the bustle of the big city.
30119,worse than showing up at your carefully chosen resort only to get nickel-and-dimed.
30120,French Hotel Guests Show Lower Fitness Activity Compared to Global Average
30121,with four great vacation ideas to offer you a little inspiration.
30122,"Well, very few things, but an après-ski spa"
30123,concise and objective.
30124,romance.
30125,packed and set your GPS: We've got some miles to cover.
30126,"reggae, secluded beaches, jerk chicken, and lush rainforest."
30127,for heightened energy and a deeper connection.
30128,"Exploring the Connection Between Yoga and Biochemical Responses"""
30129,understand how and make them accessible to those who need our help!
30130,.
30131,battle in the U.S. government's siege against whistleblowing.
30132,for right-wing outlets like Fox to smear progressive activists under the guise of “news” coverage. But why the
30133,"0 presidential election will really be like, but if it's anything like the 2012 election"
30134,", we can all agree that a stuffed bear dressed like a bee or a box of Teenage"
30135,Night Live
30136,in
30137,and Hurwitz
30138,"line: ""Bill Murray Participates in Surprise Reddit AMA"
30139,SNL Ends Episode with Sketch on Louis C.K.'s Stand-Up Career
30140,Comedian Bill Maher Discusses Parody in Comedy Industry.
30141,a totally
30142,Saturday Night
30143,": ""Actor Bill Murray Attends Baseball Game"
30144,Museum Artist-in-Residence Programs Vary in Scope and Focus
30145,It Right NOLA has assembled a living study in sustainable architecture for returning residents.
30146,"line: ""Janelle Monáe Honors Prince at New Orleans Jazz & Heritage Festival"
30147,article. Be concise and objective.
30148,"Today it was pouring rain, I pointed at an umbrella and said chair. Something about that felt familiar. I'd done it before."
30149,don't have the time.
30150,factual news headline for the following article. Be concise and objective.
30151,"be social, plugged in and available but maybe you change gears and remember what you value in life."
30152,"Write a neutral, factual news headline for the following article. Be concise and objective."
30153,"neutral, factual news headline for the following article. Be concise and objective."
30154,"Write a neutral, factual news headline for the following article. Be concise and objective."
30155,"Write a neutral, factual news headline for the following article. Be concise and objective."
30156,your smoothie.
30157,": ""Nutrition Tips for Optimal Exercise Performance"
30158,"Grocery Shopping Strategies for Reducing Expenses"""
30159,.
30160,some of the dishes we've come to love are costing our waistlines big-time.
30161,should break.
30162,talked with some top athletes about how they eat to win.
30163,they're not typically healthy. Classic deviled egg recipes are loaded with fat and calories.
30164,bad' really mean?
30165,"Hidden Ingredients in 'Healthy' Foods"""
30166,sun.
30167,following article. Be concise and objective.
30168,objective.
30169,"this time of year but good booze always helps mitigate the crud factor of autumn, and this autumn there's a ton of very fine new bottlings out there."
30170,"know for sure that waiting on security lines at airports is going to be even more unbearable than usual, and that alone is enough to drive one to drink."
30171,"Write a neutral, factual news headline for the following article. Be concise and objective."
30172,a long time in a harsh world.
30173,It's like yelling at a nun or cutting off an ambulance.
30174,Toddler's Refusal of Food Items Met with Mixed Results
30175,"No one seems more excited about, prepared for, and capable of navigating major cruises to Cuba than Norwegian Cruise Line's newly minted CEO, Frank Del Rio."
30176,"""Cruise Ship Passengers' Rights at Sea: A Complex Issue"""
30177,head.
30178,College Basketball Championship Game Remains Uncontested Despite Close Final Four Matchup
30179,": ""Greg Hardy Still Hasn't Apologized for 2014 Domestic Violence Incident"
30180,Cowboy.
30181,MLB Commissioner Rob Manfred to Address Domestic Violence Allegations Against Former Player Jose Reyes
30182,friends.
30183,.”
30184,"Write a neutral, factual news headline for the following article. Be concise and objective."
30185,"Write a neutral, factual news headline for the following article. Be concise and objective."
30186,"Write a neutral, factual news headline for the following article. Be concise and objective."
30187,"Write a neutral, factual news headline for the following article. Be concise and objective."
30188,"Write a neutral, factual news headline for the following article. Be concise and objective."
30189,Iran Nuclear Deal Sparks Debate Over Human Rights and Regional Implications
30190,t give us the stress response to kill us. She gave us the stress response to help us stay alive!
30191,"develop compassion, wisdom, and a spirit of service, there is little doubt that we who walk free can do so too."
30192,"Compassion in the Workplace: A Common yet Multifaceted Phenomenon"""
30193,news headline for the following article. Be concise and objective.
30194,’s annual congress of world soccer body FIFA is likely to become the first international forum
30195,"North Africa. The question is, transition to what? Dominating the"
30196,to dominate the pan-Arab media landscape appear to have moved into high gear
30197,led embargo of Qatar handed to the Gulf state this week
30198,. Trump’s vow to defeat what he terms radical Islamic terrorism forces the United
30199,part 4 on
30200,Saudi Crown Prince Mohammed bin Salman appears to have stepped up his risky
30201,"administration’s approach to Israeli-Palestinian peace, involving a restructuring of relations"
30202,.
30203,attah Al-Sisi has agreed to allow thousands
30204,key issues in international relations that hamper
30205,the kingdom’s founding religious ideology had a master’s voice
30206,the negotiating table.
30207,U.S. Role in Downed Iranian Aircraft Raises Questions About Authorship of Action
30208,Rand Paul [R-KY] called out U.S. participation in the Saudi war in Yemen. Senator
30209,"outcomes, the main drama still lies ahead."
30210,abused by the criminal justice system.
30211,"Write a neutral, factual news headline for the following article. Be concise and objective."
30212,the following article. Be concise and objective.
30213,Tulsa School Board Votes to Continue Value-Added Evaluations
30214,the following article. Be concise and objective.
30215,and objective.
30216,7 comes
30217,’ve climbed seven of the world’s toughest summits to mount and
30218,"harmonica, and vocals."
30219,"went beyond expectations for you and/or the group? TL: Quite a few, for"
30220,Trumpeter Chris Botti Discusses the Challenges of Mastering the Trumpet.
30221,"""Physicians' Leadership Roles in Healthcare Face Challenges"""
30222,"steps are essential to transforming simple time off, holidays and vacations into meaningful life balance for doctors and other busy people."
30223,OSA and seek treatment if diagnosed with it.
30224,and objective.
30225,"Write a neutral, factual news headline for the following article. Be concise and objective."
30226,"Write a neutral, factual news headline for the following article. Be concise and objective."
30227,"Write a neutral, factual news headline for the following article. Be concise and objective."
30228,"his ass worked at, like, Red Lobster, he'd be just a good man working at Red Lobster.”"
30229,"Write a neutral, factual news headline for the following article. Be concise and objective."
30230,"Write a neutral, factual news headline for the following article. Be concise and objective."
30231,Sports World Reflects on 2014
30232,Committee of Justice Reveals Top Four Teams in College Football Rankings
30233,.
30234,why not those investigations into the 2008 financial crisis?
30235,article. Be concise and objective.
30236,it seems to be getting along pretty nicely with Donald Trump.
30237,and objective.
30238,suggests the Senate leader may have a plan for reviving Obamacare repeal.
30239,.
30240,"line: ""Me Too Movement May Influence Upcoming Elections, Potentially Leading to Record Number of Female Lawmakers."""
30241,the issue.
30242,Congressional Leader Predicts Delay in Legislative Action Following November Elections
30243,Congress Receives Bill Text Late on Wednesday Evening
30244,": ""Executive's Family Time Demands Test Company's Flexibility"""
30245,"."""
30246,.
30247,the health care organization.
30248,GOP Leaders Avoiding Information on Legislation's Impact
30249,it anyway.
30250,to vote against it.
30251,the critical swing state of Ohio.
30252,on the line.
30253,huge fundraising month. And yet...
30254,.
30255,imperiled bill.
30256,"Trump Blames Ryan for Bad Deal, Credits Himself for Good Ones"""
30257,run out on their latest bill.
30258,"""Repeal Advocates Face Backlash Over Repeal Efforts"""
30259,to release phone locations in emergencies.
30260,state in need...
30261,care that the bill isn't particularly popular.
30262,don't support the Alabama nominee.
30263,would vote for the bill.
30264,House Republicans from Trump. Paul Ryan just connected the two.
30265,.
30266,man who helped push Boehner out is now heading the most conservative group in Congress.
30267,to make sure their constituents don't lose too much.
30268,article. Be concise and objective.
30269,ervatives are prepared to derail the appropriations process if they don't get their way.
30270,.
30271,UK Celebrates First National Sharing Day
30272,for the following article. Be concise and objective.
30273,"Write a neutral, factual news headline for the following article. Be concise and objective."
30274,"Write a neutral, factual news headline for the following article. Be concise and objective."
30275,"Write a neutral, factual news headline for the following article. Be concise and objective."
30276,"Write a neutral, factual news headline for the following article. Be concise and objective."
30277,Some Mothers-in-Law and Daughters-in-Law May Display Unhappiness Through Nonverbal Cues
30278,"Write a neutral, factual news headline for the following article. Be concise and objective."
30279,"and gave her children everything she had, she forgot to leave much for herself and had to reacquaint herself with the ""Me"
30280,of the companies' opposing takes on
30281,. With the presidential election
30282,"Google Doodle Honors Festivus Holiday"""
30283,deeply polarized political
30284,"line: ""Janet Mock Discusses Trans Identity and Representation in Media"
30285,of those really
30286,and political polarization have pushed
30287,Recent research
30288,article. Be concise and objective.
30289,your lighting and décor for the seasons.
30290,outdoor living is just as comfortable and livable as what's happening indoors.
30291,Amendment right of freedom of speech. With academic freedom comes academic responsibility and scholarly integrity.
30292,Quakertown's Sine's 5&10 Cent Store Celebrates 100 Years of Service
30293,Union Station's Ceiling Restoration Project Reaches Milestone
30294,"structures on site,"
30295,.
30296,decision not to let him personally pay for police protection while in the U.K.
30297,"Pilates-Inspired Arm Workout Can Be Done Anywhere"""
30298,Researchers Identify Key Factors Contributing to Longevity in Blue Zones
30299,can incorporate the following health and fitness tips into your plan.
30300,"Obesity and Weight Loss: A Persistent Challenge for Many Individuals"""
30301,more effective workout for you.
30302,ikes Related Content from The Active Times: 12 Sweet Spring Hikes: Wildflowers
30303,mental health.
30304,12 Top-Secret Swimming Holes 17 Fascinating Facts About Mt. Everest The Best Beasts in
30305,Click here to see more of the National Parks Showdown: U.S. vs. The World But the
30306,"Summer Fitness Tips from a Seasoned Personal Trainer"""
30307,objective.
30308,eled utopia? Put your pedal power to the test in one of these top 10 bike-friendly cities.
30309,"Travel Zen comes to us from Adam Stewart on the Cliffs of Moher in Ireland. ""One"
30310,Travel Zen... Where have you traveled for a moment of zen? Email travel@huffingtonpost.com
30311,"moment of zen? Email travel@huffingtonpost.com with your travel zen or submit below. ""This"
30312,"line: ""Russian Man Finds Inner Peace on a Remote Island in the Pacific"""
30313,": ""Bermuda Beachgoer Captures Moment of Serenity at Fairmont Southampton"
30314,"The water-energy nexus: A review of the literature"""
30315,. National governments and international
30316,": ""Spanish Colonial Governance in the Americas: A Historical Overview"
30317,war between Britain and Russia.
30318,": ""Academic Discusses Impact of Social Media on Politics"""
30319,European Leaders Pledge Support for Climate Change Efforts
30320,"line: ""New Study Examines the Relationship Between Cannabis Use and Mental Health in Young Adults"""
30321,"line: ""French Presidential Election Enters Second Round"""
30322,"""French Academic Discusses Globalization's Challenges"""
30323,"""India's Higher Education System Faces Challenges Amid Growing Enrollment"""
30324,US Trade and Labor Market Developments: Low-Tech Goods and Industry Trends
30325,": ""Economic Instability Persists in the Late 20th Century"""
30326,"Brazilian Business School Professor Faces Backlash for Comments on Diversity and Inclusion"""
30327,in their
30328,after the European
30329,ivory towers
30330,product
30331,concise and objective.
30332,"The impact of the COVID-19 pandemic on the global supply chain: A review of the literature"""
30333,19th century
30334,descents into the ocean
30335,"line: ""French President Macron Honors De Gaulle's 1940 Resistance Call Anniversary"""
30336,not the same as forcing migrants to stay in Turkey.
30337,"Iran's Presidential Election Takes Place Amid Controversy"""
30338,monarchy” in France.
30339,including
30340,"""Moroccan Entrepreneur Develops Innovative Refrigerator for Desert Region"""
30341,Alvin
30342,the election
30343,that has upsides and challenges.
30344,"European University Institute Giusi Nicolini, the Nobel Prize-nominated, Olof Palme Prize-winning and UNESCO"
30345,news headline for the following article. Be concise and objective.
30346,"Write a neutral, factual news headline for the following article. Be concise and objective."
30347,Demeter Fragrance Library Offers Nostalgic Scents for Mother's Day
30348,": ""Factors Influencing Adult Behavior Towards Family Members"
30349,communication.
30350,atively) healthy people around me dying.
30351,objective.
30352,juice
30353,a horrible thing. And I think it's
30354,"but interestingly, there is also a lot of research evaluating"
30355,"was a love letter, it would be the Anzac Biscuit."
30356,"novels, as well as the nonfiction book Dangerous Books for Girls"
30357,"Hopefully, you are starting it feeling rested, refreshed"
30358,Flowers Bloom in Summer: Exploring the Purpose and Significance of Seasonal Florals
30359,"new way of eating, but did miss the"
30360,Discounts on Non-Organic Foods May Be a Form of Psychological Manipulation
30361,"6 Portland tropes that--for me, anyway--turned out to be true and 4 that missed the mark."
30362,"Yvon Chouinard and Tom Brokaw took, I was curious"
30363,only learned a few weeks ago about the omertà--the code of silence. What's funny
30364,.
30365,"predictions, and I'm sticking to them. Photo credit: vestman Since then, I've continued to predict trends"
30366,"Tell me what I should do! Of course I will always make my own decision, but"
30367,"I use every time I fly (and I used to fly a lot for business, which"
30368,"""Study Finds Kissing Transfers Microorganisms Between People"""
30369,". Pay close attention to ingredient lists, research anything that troubles"
30370,. Be concise and objective.
30371,rich and wonderful about goose broth
30372,. Ramp
30373,Summer Heat Brings Increased Risk of Heat-Related Illnesses
30374,the healthcare reform law
30375,straighten your
30376,the vulnerable
30377,restaurant that I've
30378,"""The History of the Farm-to-Table Movement"""
30379,Recipe Instructions: Adding Dry Ingredients to Baking Mixture
30380,Parents Share Experiences of Sending Children to Summer Camp
30381,itself is totally yum and goes great with
30382,wrists and walk your feet several inches towards your
30383,"""Spaghetti Sauce and Hard-Boiled Eggs: An Unconventional Combination Gains Favor"""
30384,Almost
30385,"line: ""Local Spiritual Teacher Celebrates 40 Years of Guiding Community"""
30386,Individual Shares Personal Preferences and Annoyances in Online Post
30387,doubts
30388,Pennsylvania Resident Reflects on State's Natural Beauty and Personal Significance
30389,going
30390,Local Woman Recalls Family's Traditional Borscht Recipe
30391,for Girls
30392,headline for the following article. Be concise and objective.
30393,headline for the following article. Be concise and objective.
30394,Homemade Bread Crumbs Used in Holiday Cooking
30395,"neutral, factual news headline for the following article. Be concise and objective."
30396,factual news headline for the following article. Be concise and objective.
30397,"Write a neutral, factual news headline for the following article. Be concise and objective."
30398,headline for the following article. Be concise and objective.
30399,"Write a neutral, factual news headline for the following article. Be concise and objective."
30400,concise and objective.
30401,steps you can take to lower your exposure to BPA. You can avoid hard polycarbonate plastic water
30402,stopping distance. We should think of sleep the same way: Our minds don't just turn off after
30403,"After Christmas, lethargy takes over. It's the comedown after all the festivities"
30404,who we are.
