id,agnostic_headline
306629,prognostications have rarely been correct.
306630,115 percent from the week before.
306631,artwork appeared near a ferry that connects the U.K. to mainland Europe.
306632,Cause of Death in Mysterious Incident Remains Undetermined
306633,homeless man was taken into custody Tuesday on suspicion of aggravated homicide.
306634,a person of interest in the deaths of two Louisiana men.
306635,"and have him arrested,” the local sheriff said."
306636,Italian to win the race in 22 years.
306637,"line: ""Trump Questions Authenticity of McCabe's Notes"""
306638,"8-month-old, looking up at them.”"
306639,": ""Local Man's Actions Result in Successful Resuscitation of Deceased Individual"""
306640,attack.
306641,.
306642,"us on your cell phone whenever you need our help."""
306643,covered.
306644,couldn't hide her disgust during Monday's speeches.
306645,"with my jacket to even attempt to grab her."""
306646,"of society."""
306647,"Two Men Face Charges for Hosting Large Gatherings During Pandemic"""
306648,54-year-old Bornean orangutan was a mother of four and surrogate to two babies at Chicago's Brookfield Zoo.
306649,the following article. Be concise and objective.
306650,the following article. Be concise and objective.
306651,"athan Carman, 22, was found in a life raft off the coast of Massachusetts Sunday. His mother is still missing."
306652,on your back with your arms at your side 45 degrees away from your body and palms facing the ceiling. Bend your knees
306653,with your toes pointed on the ground in front of a swiss ball. Start by placing your forearms on the
306654,Strength Training Program to Intensify in Next Three-Week Phase
306655,.
306656,get close to your head reverse the motion by contracting your triceps and pressing your hands away from your
306657,"the motion by breaking your arms and lowering yourself, under control, until your upper arm touches your lower arm"
306658,"and repeat for given reps. Start by standing tall with your feet about hip width apart, chest"
306659,of either the slideboard bootie or a ValSlide. Make
306660,"only for attention, practice, and patience."
306661,"gravity, as he Falls here from the vertical to more than 20 degrees"
306662,take a while.
306663,"College Students Share Experiences of Studying Abroad"""
306664,"Write a neutral, factual news headline for the following article. Be concise and objective."
306665,"divorce to not take things personally. After all, you two were a partnership, a team, and now your partner has been recast as your adversary."
306666,"And, if you keep an open mind, success may look different than your original script."
306667,side. These are the ones who don't run from your tears or hide from your rants. Treasure these friends. They are true.
306668,erase him completely.
306669,Local Woman Shares Experience of Dating Multiple People in a Week
306670,of epilepsy.
306671,"Write a neutral, factual news headline for the following article. Be concise and objective."
306672,"line: ""Fast Food Flavor Profiles Tied to Common Ingredients: Salt, Sugar, and Fat"
306673,: YOUR LIPS!
306674,ur in six places; I was unable to move and had to be transported in an ambulance.
306675,Local Philanthropist Catharine Hamilton Commits to Various Community and International Causes
306676,who makes news and inspires reflection.
306677,"ens."""
306678,to be taught.
306679,"Write a neutral, factual news headline for the following article. Be concise and objective."
306680,cows tethered to a post.
306681,"better off."""
306682,Indiana Election Highlights Growing Importance of Diversity and Inclusion in Politics
306683,the following article. Be concise and objective.
306684,article. Be concise and objective.
306685,and objective.
306686,"neutral, factual news headline for the following article. Be concise and objective."
306687,"ess used the term, which many consider a racial slur, during a discussion about diversity at her network."
306688,measure success.
306689,Fox News Host Criticizes Debate Moderator for Alleged Bias
306690,voting booth.
306691,grandparents.
306692,civil rights are being violated is exactly backwards.
306693,the oldest kids show on the block?
306694,"Disney Invests $400 Million in Vice Media"""
306695,But the rising tide of election season is lifting all boats.
306696,.
306697,"BLS Report Reveals Common Reasons for Absenteeism"""
306698,opened
306699,but
306700,Fast Food Companies Explore Healthier Options Amid Changing Consumer Preferences
306701,decide to abolish the police.
306702,": ""Taylor Swift's Album '1989' Generates Significant Revenue"
306703,even in season.
306704,following article. Be concise and objective.
306705,es college students' cell phone mania to track the spread of illness.
306706,"The creative people are blossoming on television,"
306707,"long been saying, but many consumers refuse to believe"
306708,when sandwich chain Subway announced that it was removing
306709,"Individual Tests Restaurant and Group Cooking in MyPlate Experiment"""
306710,concise and objective.
306711,"Blumhouse Productions, will be called ""Get Out."""
306712,according to USA Today's Bruce
306713,the 'Parenthood' reunion we've been waiting for.
306714,director was thinking about John Wayne when he tweaked the Greedo scene.
306715,", and overtreating, some types of cancer."
306716,of the most acclaimed and beloved
306717,can really tell the difference.
306718,sex.
306719,Kerry Unclear on Sanctions Agreement
306720,Founders' Intent Behind Fifth Amendment Examined
306721,following article. Be concise and objective.
306722,"Write a neutral, factual news headline for the following article. Be concise and objective."
306723,"Write a neutral, factual news headline for the following article. Be concise and objective."
306724,"Write a neutral, factual news headline for the following article. Be concise and objective."
306725,"Write a neutral, factual news headline for the following article. Be concise and objective."
306726,"each other than any oysters, petit fours, or champagne would ever allow."
306727,"and engage with others more purposefully, meaningfully, and effectively."
306728,"on Thursday it would support a 48-hour ceasefire in Aleppo, a move the U.N. Syria envoy said would allow aid to reach besieged areas soon."
306729,"Write a neutral, factual news headline for the following article. Be concise and objective."
306730,news headline for the following article. Be concise and objective.
306731,"Write a neutral, factual news headline for the following article. Be concise and objective."
306732,Former Student Recalls Experience at Israeli Kibbutz Ulpan
306733,"one thinks of American Sniper, Eastwood is much more subtle than some jingoistic zealot."
306734,": ""Local Man Reflects on Late Mentor's Impact"
306735,"Venice, Biden trafficked in one of the most insidious stereotypes about Jews, that the people of the book are unethical money lenders."
306736,"line: ""President Obama Reflects on His Identity and Career Path"
306737,ruin dinner and probably the day.
306738,you going to do with that?
306739,will take on behaviors that create luck.
306740,"even knew it would end badly, but you dated him anyway. That's cortisol."
306741,"Cortisol's Impact on Health: Understanding the Risks and Solutions"""
306742,"Couple Spends Five Days in Bermuda, Engages in Relaxation and Leisure Activities"
306743,the following article. Be concise and objective.
306744,’s work is never done…” - Children’s Song It’s no secret: health
306745,article. Be concise and objective.
306746,"56, recently was diagnosed with early-stage endometrial cancer. I’m wondering if this"
306747,"put us at risk, no matter what we decide to do."
306748,Experts Weigh Benefits and Challenges of Emerging Technology
306749,and conform to fit into the highest social circles.
306750,"""Travelers Seek Mindfulness Amid Holiday Chaos"""
306751,us to be how we want to be.
306752,get some perspective.
306753,"Breaking Free from Addiction: A Path to Recovery and Renewal"""
306754,"line: ""Mindfulness Practices Gain Popularity in Western Culture"
306755,"Write a neutral, factual news headline for the following article. Be concise and objective."
306756,"""Research Links Volunteering to Lower Depression Rates"""
306757,different times.
306758,and from common destinations.
306759,"Write a neutral, factual news headline for the following article. Be concise and objective."
306760,hover in a parking lot filled with disrobing surfers.
306761,"Write a neutral, factual news headline for the following article. Be concise and objective."
306762,"Write a neutral, factual news headline for the following article. Be concise and objective."
306763,"European, took the lead."
306764,felt the same way about my wedding ceremony many years ago. I really cared more about where we would go on vacation afterward than what flowers I carried.
306765,Homeowner Experiences Series of Window Malfunctions
306766,"true, there are times they make me cringe."
306767,"Write a neutral, factual news headline for the following article. Be concise and objective."
306768,"goodness, what a life. How many of us can know that we made an impact on so many, inspired so many, taught so many?"
306769,"sauce is a mayonnaise-based sauce with canned tuna, often flavored with anchovies, super flavorful, quite rich and pleasingly retro."
306770,Ireland's Blasket Islands: A Group of Islands Located Off the Dingle Peninsula
306771,Smith.
306772,.
306773,this story.
306774,many on view.
306775,leaves the story.
306776,"Syfy Channel Debuts New Mini-Series 'Ascension'""."
306777,has entered into a $175 million settlement agreement as a result of allegations that it discriminated against black and Hispanic mortgage applicants.
306778,.
306779,"Write a neutral, factual news headline for the following article. Be concise and objective."
306780,", or ingredients known to be highly allergenic to pets."
306781,ethanol toxicosis.
306782,as I notice a problem.
306783,down at you from atop his tree.
306784,headline for the following article. Be concise and objective.
306785,"neutral, factual news headline for the following article. Be concise and objective."
306786,"s practice philosophy. Ideally, your vet's approach to keeping your pet healthy will mirror your own."
306787,Pet Owners Advised on Safe Options for Leaving Dogs Alone
306788,"study of obese dogs with osteoarthritis and lameness proved how little effort it can take to vastly improve the quality of life of overfed, disabled pets."
306789,chewing can be alleviated by mechanically removing (rinsing off) allergens and other irritants collected on your dog's paws?
306790,"are. But if your pet tolerates it well, a sweater can help keep your dog warm, especially when you take her outdoors."
306791,"and they live in the hood, well, the suburban gated neighbor'hood."
306792,lists. Don't be too concerned about the quantity of the sex you're having as long as your having some.
306793,factual news headline for the following article. Be concise and objective.
306794,"Write a neutral, factual news headline for the following article. Be concise and objective."
306795,.
306796,Parents' Involvement in Children's Lives Discussed in Article.  Next:
306797,"Mediterranean's charm is based largely upon its history, cuisine, sun-bleached villages, and relaxed lifestyle, and nowhere are these on better display than its many islands."
306798,article. Be concise and objective.
306799,headline for the following article. Be concise and objective.
306800,.
306801,"bash, La Tomatina, have made the international tourist radar and now draw visitors from around the world."
306802,"; a mouth; frankly, we're all exhausted, seriously exhausted."
306803,"led fall on their swords while the unprincipled keep theirs.” Robert Reich, 12.7.17 Revolution"
306804,first child.
306805,Dzhokhar Tsarnaev Sentenced to Death for Boston Marathon Bombing Role
306806,"Write a neutral, factual news headline for the following article. Be concise and objective."
306807,the following article. Be concise and objective.
306808,pool or take in students who couldn't leave campus after classes were canceled.
306809,"Multiple media reports say students wore blackface, but no photos have emerged to prove it."
306810,small Minnesota college of failing to support her after she was sexually assaulted overseas.
306811,following article. Be concise and objective.
306812,objective.
306813,but others say the school didn't do enough.
306814,following article. Be concise and objective.
306815,UC President Credits Survivors for Bringing Attention to Campus Rape Issue
306816,policies and programs are effective.
306817,"is ""f**ked up."""
306818,"Dartmouth Fraternity Memoir May Be Adapted into Film"""
306819,"line: ""Self-Care Essential for Effective Community Service, Expert Says"""
306820,aren't saying much.
306821,team has not.
306822,up to its disappointing record.
306823,: Female Comedians Find Support in Private Facebook Forums
306824,"Academics Question Government's Approach to Free Speech Regulation"""
306825,"""College's Handling of Assault Case Under Scrutiny"""
306826,"line: ""Students Condemned for Skin Care Efforts in Campus Email"
306827,cases.
306828,attention.
306829,"line: ""College Assault Cases Often Involve No-Contact Orders, But Their Effectiveness Is Questioned."""
306830,places.
306831,laws.
306832,"neutral, factual news headline for the following article. Be concise and objective."
306833,"neutral, factual news headline for the following article. Be concise and objective."
306834,headline for the following article. Be concise and objective.
306835,Be concise and objective.
306836,the following article. Be concise and objective.
306837,"wants to speak out against ""binge drinking and sexual promiscuity,"
306838,",400 students and alumni from the Wharton School condemned the GOP candidate's ""prejudice and intolerance."""
306839,Individuals' Perceptions of External Rules and Personal Autonomy
306840,"as ""other."""
306841,the rightness of it all.
306842,Fifty Shades of Grey Sparks Debate Over Domestic Violence in Relationships
306843,"a neutral, factual news headline for the following article. Be concise and objective."
306844,"present in this moment, and to use as much wisdom as we can muster to move forward in life by doing as little harm as possible."
306845,it has ever been. Do our choices enhance life for all of us? It seems to me the wisdom lies in letting the extinct stay extinct.
306846,find all kinds of reasons to ignore that calling.
306847,-Catholics alike visit the Basílica to kiss that very pillar seeking protection and showing their faith and love for Virgen del Pilar.
306848,"line: ""Eastern State Penitentiary: A Historic Prison's Decline and Legacy"""
306849,Expert Discusses Emotional Impact of Betrayal and Trust Violation
306850,tell my 20-something self. Here are some of the things I would say to her.
306851,"Write a neutral, factual news headline for the following article. Be concise and objective."
306852,"Write a neutral, factual news headline for the following article. Be concise and objective."
306853,"a neutral, factual news headline for the following article. Be concise and objective."
306854,"Write a neutral, factual news headline for the following article. Be concise and objective."
306855,following article. Be concise and objective.
306856,policies and punishes officials who enact them.
306857,’s time for a change because most of us here are Hispanic.”
306858,Trump vowed during the campaign to kill.
306859,igration cases already occupy about half of the federal criminal docket.
306860,the criminal justice system.
306861,in the new legislative session.
306862,making faces.
306863,US Offers $20 Million Reward for Capture of Rafael Caro Quintero
306864,discrimination without solving any problem.
306865,to overturn trade sanctions yet.
306866,a major uptick in Cuban migration.
306867,Federal Judge's Ruling May Allow DACA Program to Continue Beyond Current Administration
306868,"."""
306869,"line: ""Mexican President Denies Funding for Border Wall"""
306870,setback for ethnic studies advocates.
306871,that Republicans aren't talking about.
306872,signature immigration achievement.
306873,the new policy is announced.
306874,a socially conservative agenda.
306875,Lakers team.
306876,Expert Testifies on Scope of Unauthorized Image Sharing
306877,presidential candidate’s hate-filled rhetoric.
306878,the recognition he deserves.
306879,"in terms of total acceptance."""
306880,"Write a neutral, factual news headline for the following article. Be concise and objective."
306881,"Write a neutral, factual news headline for the following article. Be concise and objective."
306882,"Write a neutral, factual news headline for the following article. Be concise and objective."
306883,"Write a neutral, factual news headline for the following article. Be concise and objective."
306884,"Write a neutral, factual news headline for the following article. Be concise and objective."
306885,"Write a neutral, factual news headline for the following article. Be concise and objective."
306886,"Write a neutral, factual news headline for the following article. Be concise and objective."
306887,Hotels with Private Outdoor Showers Offer Unique Experience for Guests
306888,"New, Independent Hotels Emerge in NYC"
306889,annah Grant script full of one-liners.
306890,and objective.
306891,"star Felicity Jones says it's ""a film that’s about unity."""
306892,as part
306893,.
306894,McCarthy movie poster has seen: Melissa
306895,Be concise and objective.
306896,"Oscar Nominees Announced for Best Cinematography"""
306897,concise and objective.
306898,objective.
306899,", factual news headline for the following article. Be concise and objective."
306900,Shia LaBeouf and newcomer Sasha Lane star in Andrea Arnold's prizewinner.
306901,concise and objective.
306902,ushering in a wave
306903,interview in the U.K. It will air nightly from Monday through Thursday
306904,"line: ""The Bloody Beetroots Release New Music Video Featuring Paul McCartney and Youth"""
306905,"Actor Discusses Recent Film Controversies and Career Experiences"""
306906,ificent Seven
306907,"Beyoncé Performs 'Standing on the Sun' for First Time in Concert in Antwerp"""
306908,actor could start 2016 with an Oscar nomination.
306909,"is a fun, fascinating peek backstage."
306910,man obsessed with a fake children's show.
306911,"-screen adaptation opens, Walls is finally comfortable revealing her past."
306912,"Really Here,"
306913,the season's many must-see releases.
306914,"""Streaming Services Increase Involvement in Oscar Campaigns"""
306915,just one idea presented in Werner Herzog's new doc about the internet.
306916,"Music Festival Returns After Hiatus, Receives Mixed Reviews"""
306917,"year-end rankings, including"
306918,.K. comedy and a slew of Oscar hopefuls.
306919,"women who speak out against any abuse and misuse of power."""
306920,working through the themes that haunt our national headlines.
306921,her goth-to-prep transition in the first place.
306922,Talking Heads before the film's Dec. 25 release.
306923,way to extend the franchise past its 10th installment.
306924,Rebecca Black Discusses Exhaustion After 'Friday' Release
306925,helping gay people flee the small Russian republic.
306926,"undergoing an identity crisis, just like the entire country."
306927,", a scary dinner party or Obama's college days."
306928,"film, tweeted some concern about the news on"
306929,"and ""Veep"
306930,Kanye West Collaborates on Beyonce Remix
306931,for the following article. Be concise and objective.
306932,"Rihanna's Representative Denies Rumor About Singer's Personal Life"""
306933,"Heathers,"
306934,. Be concise and objective.
306935,"ies ""Too Young To Die"
306936,": ""Spike Lee's Filmography Includes a Variety of Genres and Themes"""
306937,"cleaned up, but no actors of color earned nods."
306938,Z
306939,", which"
306940,satire's fifth season.
306941,Katy Perry's New Single Leaks Early
306942,also premiering on Amazon.
306943,.
306944,but it's not going too well.
306945,West's Upcoming Album Details Remain Under Wraps
306946,"Panther""?"
306947,of
306948,Harry Potter
306949,"Actors Discuss Recent Projects and Personal Lives"""
306950,"line: ""Comedy 'Tangerine' Features Foot Chase and Slower Pacing"
306951,": Jay Z's ""Picasso Baby"
306952,and objective.
306953,meaning. We pry outstanding projects
306954,"William Friedkin Discusses New Documentary and Contemporary Issues"""
306955,"two nods and Jonah Hill snuck in for ""War Dogs."""
306956,.
306957,pound after pound to the point of looking
306958,"line: ""New film 'The 48 Laws of Power' to be released in theaters nationwide, based on Robert Greene's self-help book."""
306959,.
306960,and drank expertly crafted coffee in the company of strangers in the rain.
306961,.
306962,"Write a neutral, factual news headline for the following article. Be concise and objective."
306963,Post-Holiday Season Brings New Year's Resolutions and Food Choices
306964,15 exercises to help build your leadership muscles.
306965,"about judges and magistrates having too much power, making way too many decisions based not on law or precedence, but on their own personal or religious beliefs."
306966,-- so much so that all are feared as imminent threats?
306967,", is the spectacle of a Southern lynching upon a swing set, a symbol of youthful euphoria now rendered the site of a Black youth's strangulation."
306968,of many of our people remain great.
306969,and objective.
306970,and objective.
306971,.
306972,Specialty Diets Now More Accessible Than Ever
306973,than trying to shop the mall or stores. It can also be just as fun. Here's how...
306974,need to change location.
306975,cozy and comfortable casa that is all your own even if you're renting yours.
306976,"space, remodeling, updating, painting, or just mixing in new pillows and other decor items."
306977,"ine, beer and liquor has been making a cool comeback in everything from chocolate to full-on meals at some of the hottest restaurants in the country."
306978,.
306979,Union Leaders Face Criticism for Outdated Leadership Style
306980,for the American economy is not the way to fix those pressing problems.
306981,Fred Kirsch is truly a technology innovator and someone who is focused on digital business transformation.
306982,a high-level overview of business model innovation.
306983,"Write a neutral, factual news headline for the following article. Be concise and objective."
306984,the following article. Be concise and objective.
306985,"Author Discovers Puerto Rico and Becomes Enthusiastic Advocate for the Island"""
306986,the following article. Be concise and objective.
306987,"Write a neutral, factual news headline for the following article. Be concise and objective."
306988,headline for the following article. Be concise and objective.
306989,Be concise and objective.
306990,"Write a neutral, factual news headline for the following article. Be concise and objective."
306991,", Calif., Dec 5 (Reuters) - Islamic State said on Saturday that the married couple who killed 14 people in"
306992,"a neutral, factual news headline for the following article. Be concise and objective."
306993,"line: ""Local Woman Reflects on Empowerment Through Interfaith Understanding"""
306994,"Armenian and Turkish Leaders Discuss Historical Conflict"""
306995,"""American Sniper Sparks Debate Over Portrayal of Iraq War"""
306996,"Criticism of Public Figures Can Be Counter-Productive, Experts Say"
306997,"Earlier this week, I posted a story about ICS, the private Swiss school where my son with special needs, is now enrolled"
306998,"day and night in the curious ways and means of children, rendering me forever changed as an individual."
306999,. Be concise and objective.
307000,instructors and faith in my children's abilities.
307001,"closer to establishing a causal link between the two conditions, by examining specifically the direction of the relationship between the two."
307002,": ""9 Million US Adults Use Prescription Sleep Aids in Past Month"
307003,found obstructive sleep apnea associated with a significantly increased risk of sudden cardiac death.
307004,.
307005,Sleep Science Advances Highlighted in 2012 Research
307006,lifestyle factors that also can interfere with teens' sleep.
307007,your risks if you are properly evaluated for obstructive sleep apnea.
307008,for depressive disorders.
307009,boost your learning power by beefing up your sleep routine.
307010,a whole lot more seriously.
307011,"if outdated, could interfere with diagnosis and treatment."
307012,Street work could take its toll on sleep and overall health.
307013,"Soldiers Face Elevated Risk of Sleep Problems, Research Suggests"
307014,the National Hockey League that is addressing sleep problems on several fronts.
307015,"a neutral, factual news headline for the following article. Be concise and objective."
307016,.
307017,"""Scientists Study Circadian Rhythms to Better Understand Human Physiology"""
307018,how deeply sleep can influence the emotional dynamic of a relationship.
307019,"before they become serious, we can help keep our kids sleeping well and growing well."
307020,"disease, and diabetes. But did you know that insomnia may also increase your risk of injury?"
307021,"Experts Recommend Developing a Sustainable Sleep Routine for Better Health"""
307022,"line: ""Ritz-Carlton Concierge Discusses Art Basel Expectations and Featured Artists"
