id,agnostic_headline
303283,don't develop the ability to direct their lives from their own center of gravity.
303284,people's private interests and identities.
303285,through the night.
303286,for the following article. Be concise and objective.
303287,", factual news headline for the following article. Be concise and objective."
303288,", comfortable and improve the wear pattern of your shoes."
303289,a daunting task. Using these helpful tips can now make your life much easier.
303290,"Brides Planning a beach wedding? You'll need a hairstyle that can withstand a day in the sun, not to mention"
303291,.
303292,concise and objective.
303293,"Wedding Planning: Tips for Staying Sane"""
303294,"devoted to will just reflect upon you, and that quality will become you."
303295,experience life in a way that others do not know.
303296,aspects to knowing life: pragna or samadhi. Pragna is the path of awareness. Samadhi is the path of abandon.
303297,Photographer Captures Image of Dragonfly on Car Antenna
303298,routines become holy.
303299,"brilliant red dress and feathered headpiece, a stunning impossible vision that for an instant I think is a heat mirage."
303300,"neutral, factual news headline for the following article. Be concise and objective."
303301,Year's resolution: Travel more. We've looked into the 2013 crystal ball and found destinations to dazzle in the year ahead.
303302,", travelers can leave their TSA-friendly bottles at home or take souvenir toiletries to go. Hotels, happily, have taken notice."
303303,hotel room.
303304,Airline Pricing Practices Criticized for Being Based on Passenger Willingness to Pay
303305,": ""Maintaining a Healthy Balance on Vacation"
303306,-worthy state fairs.
303307,flight.
303308,hand. Raise your glass and check out 10 beautiful beach bars worth the trip!
303309,"of your belongings inside your bag, will almost certainly stay put."
303310,there. Here are 10 urban legends that just aren't true.
303311,-diming when possible.
303312,"""European Travelers Discover Hidden Gems in Local Dining Scenes"""
303313,"Stress at Airports (TSA). Luckily, there is a prescription."
303314,the coming year.
303315,knew existed.
303316,"neutral, factual news headline for the following article. Be concise and objective."
303317,Trusted Traveler Programs Offer Expedited Security and Border Processing
303318,"to cram five bags, a jacket, and a pillow into the overhead compartment? Don't be that guy."
303319,.
303320,do.
303321,objective.
303322,"Write a neutral, factual news headline for the following article. Be concise and objective."
303323,objective.
303324,"Write a neutral, factual news headline for the following article. Be concise and objective."
303325,"Write a neutral, factual news headline for the following article. Be concise and objective."
303326,"Local Man Dies After Long Illness"""
303327,following article. Be concise and objective.
303328,"Paper Mill Answers Common Questions About Toilet Paper Production"""
303329,life.
303330,for the following article. Be concise and objective.
303331,"Write a neutral, factual news headline for the following article. Be concise and objective."
303332,"with what others are doing -- we might tell ourselves, ""I'm choosing this job, so it's OK, I am a good mom."""
303333,"Write a neutral, factual news headline for the following article. Be concise and objective."
303334,or social media. It's essential to plan ahead when deciding on an international cell phone plan or SIM card for your travels in Europe.
303335,"Write a neutral, factual news headline for the following article. Be concise and objective."
303336,news headline for the following article. Be concise and objective.
303337,"meals provide at least 20 grams of high-quality protein, lots of fiber for added fullness and no more than 450 calories."
303338,"Navigating Airport and City Restaurant Menus to Avoid Overeating"""
303339,"adequate sleep, things can go awry fairly quickly."
303340,upgrade your training to the next level.
303341,prove challenging.
303342,have great meals and great fun.
303343,"store for visitors, and for those who plan to spend a few days here, the following attractions should not be missed."
303344,windows.
303345,"70s -- the 1870s, that is."
303346,", Connecticut at night, and she might reply: ""At home, with the locks firmly bolted."""
303347,spoiled by hunky river brats.
303348,artistic community spirit.
303349,Fashion and Lifestyle Products for Various Interests and Needs
303350,", and it's worth at least a few days to explore."
303351,"Dr. Frans von der Dunk weighs in on the space bill that just passed Congress and what exactly being a ""space lawyer"
303352,Manhattan will give homeless teens a safe place to stay.
303353,.”
303354,some of the world's most challenging diseases.
303355,rather than urging corporations to take the advocates
303356,Psychiatric
303357,and objective.
303358,"Celebrity Fashion: Corinne Bailey Rae and Other Style Influencers Featured in Weekly Slideshow"""
303359,"Beyonce, Alicia Keys, Vanessa Williams Attend NAACP Image Awards"
303360,"line: Vanessa Williams Discusses Her Age on the ""Today Show"
303361,Tina Turner Attends Armani Fashion Show in China
303362,"line: ""Local Designer Unveils New Fashion Collection"""
303363,"line: ""Models Showcase Various Outfits at Recent Fashion Event"
303364,"line: ""90s Fashion Trends Make a Comeback"
303365,to applaud
303366,House
303367,Naomie Harris Discusses Her Fitness Routine and Beauty Secrets
303368,line: Kerry Washington's Oscar Look: A Preview of What's to Come
303369,"""BET Awards 2012 Underway"""
303370,", but since the group went"
303371,"Celebrating Mother's Day: A Tribute to Moms Everywhere"""
303372,line:
303373,Actress Essence Atkins Joins Fashion Scene in 2013.
303374,decidedly hip-hop
303375,Singer Solange Knowles Wears Pink Twenty8Twelve Dress at Event.
303376,Solange Knowles attends event in printed suit.
303377,"""Earth Day Prompts Discussion on All-Natural Products"""
303378,the New
303379,outstanding achievements of people
303380,started
303381,are coddling
303382,"Apple Releases New Line of MacBook Cases"""
303383,women like Crespo
303384,"line: ""Gabrielle Union and Dwyane Wade Attend Calvin Klein Collection's FNO Event in NYC"
303385,Singer Hosts Pre-Oscars Event in Donna Karan Outfit.
303386,"""Casting Directors Face Criticism Over Diversity in Fashion Industry"""
303387,"gusting."""
303388,"ready to address this urgent problem and work toward solutions."""
303389,"rest hand on Atlas Shrugged when taking oath of office."""
303390,objective.
303391,objective.
303392,headline for the following article. Be concise and objective.
303393,"with no ""yeah buts"
303394,-- it is only then that our authentic voice arises and gives unique expression to who we are.
303395,"Write a neutral, factual news headline for the following article. Be concise and objective."
303396,seems many people spend a lot of time in their grumpy pants. They are not even aware they are wearing them.
303397,"Write a neutral, factual news headline for the following article. Be concise and objective."
303398,.
303399,"Chipotle's Build-Your-Own Concept Allows for Customization and Nutrition Control"""
303400,"as it turns out, makes breathing challenging."
303401,in their blood.
303402,need to know to look like a pro.
303403,feeling looser and less sore.
303404,"For SELF, by Emily Abbate. They're right up there with texts from your ex. There are few feelings better than the one you"
303405,Couples Can Consider Using Separate Bedding for Comfort.  Next Steps:
303406,"you feel alert, alive and fit as always."
303407,butt. But let's face it: It can be insanely boring. The fix? Getting smarter about your intervals.
303408,"Write a neutral, factual news headline for the following article. Be concise and objective."
303409,"neutral, factual news headline for the following article. Be concise and objective."
303410,factual news headline for the following article. Be concise and objective.
303411,Gratitude Journey Continues Beyond Initial Challenge
303412,"Write a neutral, factual news headline for the following article. Be concise and objective."
303413,"Write a neutral, factual news headline for the following article. Be concise and objective."
303414,headline for the following article. Be concise and objective.
303415,"Write a neutral, factual news headline for the following article. Be concise and objective."
303416,Digital Detox Movement Aims to Balance Tech Use with Real-World Connection
303417,"Write a neutral, factual news headline for the following article. Be concise and objective."
303418,"Write a neutral, factual news headline for the following article. Be concise and objective."
303419,"Write a neutral, factual news headline for the following article. Be concise and objective."
303420,"Write a neutral, factual news headline for the following article. Be concise and objective."
303421,"Write a neutral, factual news headline for the following article. Be concise and objective."
303422,"Write a neutral, factual news headline for the following article. Be concise and objective."
303423,", the trails and pavement are waiting to meet your feet. I'll be out there chasing another PR in my quest for the marathon."
303424,"Defining What It Means to Be a Runner"""
303425,objective.
303426,. Be concise and objective.
303427,. Be concise and objective.
303428,"Write a neutral, factual news headline for the following article. Be concise and objective."
303429,"Write a neutral, factual news headline for the following article. Be concise and objective."
303430,for the following article. Be concise and objective.
303431,"Write a neutral, factual news headline for the following article. Be concise and objective."
303432,t: jack up the wage floor.
303433,"street, he mocks all of us."""
303434,"labor federation insists the ""union workers love Trump"
303435,AFL-CIO Spends $1 Million on Ads Targeting Moderate Democrats.
303436,. It's about keeping teachers in their home state.
303437,.
303438,.
303439,ence -- may eventually keep stores closed on the holiday.
303440,objective.
303441,"Hardee's Agrees to Overtime Settlement, Labor Secretary Nominee Involved"""
303442,Donald Trump to help them out.
303443,falling for years. It may drop even more after this case.
303444,be a big mistake to declare them anything but traditional workers.
303445,essential
303446,Priebus called on intelligence officials to lay out what they've got.
303447,": ""Restaurant Executive Nominated for Labor Department Post"""
303448,digital media union movement.
303449,"8 years I feel like dancing."""
303450,shows just how weak our labor laws are.
303451,close the gender wage gap.
303452,Giuliani Expresses Uncertainty About Possibility of Future Event.
303453,"Senator Calls for Repeal of Right-to-Work Laws, Easier Unionization"
303454,"Iowa becomes first state to retroactively ban local minimum wage hikes."""
303455,Fox News.
303456,be our own cashiers.
303457,slash taxes for a decade.
303458,State Legislatures Use Preemption Laws to Block Local Progressive Policies
303459,strike in massive numbers.
303460,of his nomination amid a swirl of controversies.
303461,"line: ""Hospitality Union Plans Nationwide Demonstrations for Worker Protections"
303462,her confirmation hearing.
303463,this year.
303464,.
303465,comprehensive and progressive labor agenda.
303466,it as a cautionary tale.
303467,proposal that would have raised it to $15.
303468,ize. The president may have already stopped them.
303469,"figure they can’t treat me any worse,” the candidate explained."
303470,Arizona Bill Would Lower Tipped Minimum Wage
303471,House official said.
303472,for school. That's one reason the teachers announced their walkout well ahead of time.
303473,Be concise and objective.
303474,Be concise and objective.
303475,factual news headline for the following article. Be concise and objective.
303476,"Write a neutral, factual news headline for the following article. Be concise and objective."
303477,laws when it blocked Birmingham from raising its wage floor to $10.10.
303478,", hanging prizes, blaring songs are all background as Oz tells a Brothers Grimm story, his own."
303479,Mexican Carnies' Food Purchasing Habits Revealed
303480,Local Man Shares Stories of Northern Rockies Region's History with Hitchhiker
303481,book.
303482,. There seems
303483,spring shopping. (We
303484,gymnastics star proudly waved
303485,to
303486,"-themed without being too obvious, that"
303487,arm and a leg for
303488,if
303489,"line: ""Celebrity Sightings: Matthew McConaughey, Kendall Jenner Spotted at Fitness Studio"""
303490,"""The 10 Most Expensive Perfumes In The World"""
303491,"line: ""Rashida Jones Discusses Her Career and Personal Life in Interview"""
303492,last through the
303493,: Australian Fashion Designer Prue Acton Establishes Apparel Business at 20.
303494,": ""Naomi Campbell's Career Spanned Multiple Industries"""
303495,"St. Patrick's Day Approaches, Expected to Draw Large Crowds"
303496,case when
303497,"Style on Twitter, Facebook, Tumblr"
303498,", we knew"
303499,Kiehl's Creamy Eye Treatment: A Product Review.
303500,Be sure to check
303501,her iPod!) The
303502,"Tumblr, Pinterest"
303503,in an outfit
303504,"know it's early, but you have to get a jump!"
303505,": ""The 10 Most Stylish Women in the World"""
303506,my clothes again.
303507,": ""Actress Spotted Filming Scenes for 'Gossip Girl' in NYC's West Village"
303508,line: Actress Eva Mendes spotted wearing a blue printed dress.
303509,Celebrities' Outfits Draw Attention at Recent Event
303510,"Beauty Trends: Hair and Lip Color Preferences Revealed"""
303511,"Macy Gray's Prom Dress Sparks Mixed Reactions"""
303512,Home Decor Project Experiences Challenges with Adhesive Stickers
303513,"line: ""Celebrity's 32nd Birthday Marked with Nostalgic Photo Share"
303514,"""Fashion Trends for the New Year: A Guide to What's Hot and What's Not"""
303515,just
303516,"""The 10 Best Sunglasses for Women This Summer"""
303517,"weather, it was their"
303518,"Local Teen Spotted Wearing Overalls"""
303519,Bianca Jagger's Enduring Influence on Fashion and Culture
303520,wearing
303521,Scotch Naturals Water-Based Nail Polish Line Introduced
303522,"""Fashion Experts Share Tips on Layering for a Polished Look"""
303523,"""Local Woman Finds Success with Homemade Face Mask Recipe"""
303524,Facebook
303525,": ""Luxury Tights Available for Purchase"""
303526,"line: ""The 10 Most Stylish Women in the World"""
303527,"""Lena Dunham's Early Career and Rise to Fame"""
303528,body-skimming gown with architectural cut-outs
303529,"feather train, but one way"
303530,exception. PHOTOS
303531,a little longer to discover what
303532,uffPostStyle. -- Do
303533,J.Crew Collaborates with Sperry Top-Sider on Limited-Edition Boat Shoes
303534,"Twitter, Facebook, Tumblr, Pinterest and"
303535,. The tacked-on embellishments
303536,Costume
303537,you'll have money leftover for your 401k.
303538,Beauty
303539,"Fashion Designer Derek Lam Unveils Spring 2014 Collection"""
303540,love
303541,Celebrity Style Advice from Nicole Kidman and Liam Hemsworth
303542,Beauty
303543,"""Geri Halliwell Spotted in London"""
303544,"""2013 Grammy Awards Red Carpet Draws Big Names, Glamour"""
303545,"Local Child Performs at Various Events"""
303546,": ""Celebrities Attend Premiere of 'The Perks Of Being A Wallflower' in New York City"""
303547,Girls' Shopping Habits Diversify to Avoid Fashion Repetition
303548,Travelers Report Positive Experiences with Purchases Made Abroad
303549,"""Celebrity's Life and Career Remembered"""
303550,"The 10 Most Stylish Women of All Time"""
303551,Czech Model Wears Midi-Length Dress on Runway.
303552,Fashion Week in New York Features Daring Designs and Bold Statements
303553,backlit with blue lighting
303554,"collection, she always"
303555,re in love
303556,"microphone, but she also"
303557,Local Woman Shares Expertise on Acne Treatment
303558,Michelle Persad
303559,concise and objective.
303560,": ""Abigail Breslin's Early Career Beginnings"
303561,performers of his time. With standout performances
303562,no excuse
303563,t
303564,"Model Wears Sheer, Plunging Gown at Fashion Event"
303565,after
303566,Cheryl Cole Wins Spot on Reality TV Show.
303567,Celebrity's 1973 Photo Shoot Features Racy Outfit
303568,"Be sure to check out HuffPost Style on Twitter, Facebook, Tumblr, Pinterest and Instagram at @HuffPostStyle. There"
303569,-- because he wanted to share everything he's learned during his almost two decades of retirement.
303570,"consider all sources of income before making a decision about Social Security, including the use of a reverse mortgage that are growing more popular."
303571,-vous with catastrophe.
303572,Public Opinion Polls Indicate Shift in Demographic Trends May Counterbalance Conservative Legislation
303573,.
303574,And my sensitivity is the essence of who I am.
303575,help you and others heal at the same time.
303576,"Write a neutral, factual news headline for the following article. Be concise and objective."
303577,us care about the environment we travel in and want to take part in influencing it in a positive way. The Corcovado Foundation offers just that to travelers in Costa
303578,Peruvian Couple Adapts to Life Without Running Water
303579,"pain, it's not something to avoid either. It's just part of life -- and it can be a gift."
303580,"on Facebook. Specifically, this student requested suggestions for NLP (neuro-linguistic programming) techniques that could help."
303581,"Write a neutral, factual news headline for the following article. Be concise and objective."
303582,"person on the planet asked, ""What's your greatest fear?"
303583,I'm not a Tiger Mom. I'm not Free Range. And I'm not trying to Have It All. Sometimes -- often -- I'm just trying not to lose it.
303584,Comedian Phyllis Diller Dies at 95.
303585,", snowball thrower..."
303586,", / Two new parents of one little girl / Paid a very big hospital bill."
303587,"suds, consider these well-brewed destinations for a flavorful pint of repose."
303588,"ghorst, the senior editor covering the cruise industry for Travel Weekly, said that after the Carnival"
303589,riverboat Nenita.
303590,", whether your love is for art, culture or simply a great walk."
303591,objective.
303592,.
303593,view of attractiveness is blamed for causing the increase in cases of anorexia and bulimia nervosa.
303594,"Write a neutral, factual news headline for the following article. Be concise and objective."
303595,"Write a neutral, factual news headline for the following article. Be concise and objective."
303596,"Dads Get Sweet Treats This Father's Day"""
303597,". From Chocolate Chip Blondies to Lemon Pound Cake, all of these touchdown treats are easy to make and fun to eat."
303598,"and delicious foods. These dishes may take a little longer to make, but they're totally worth the extra time."
303599,article. Be concise and objective.
303600,"you're in the mood for healthy soup, a savory summer side or a sweet snack, these zucchini recipes have you covered."
303601,recipes before the weather turns cool.
303602,", light and fresh is always the most satisfying. These fruity treats will conquer your cravings -- almost guilt-free."
303603,Be concise and objective.
303604,": ""Local Woman Creates Fall-Inspired Salad Recipe"
303605,"end. But before it ends, hurry up and make these recipes before the weather turns cool!"
303606,". These recipes are so easy, even the kids can make them (with a little help from dad)."
303607,Baileys Irish Cream Chocolate Brownies with Cheesecake Swirl Recipe Released
303608,"Whipped Mascarpone Cream to decadent Chocolate Peanut Butter Pie, these desserts all have serious wow-factor."
303609,"Write a neutral, factual news headline for the following article. Be concise and objective."
303610,"Write a neutral, factual news headline for the following article. Be concise and objective."
303611,"Vegetarian Soup Recipe Offers Quick, Hearty Winter Option"""
303612,don't have to be Irish to celebrate this delicious day. Try one (or all) of these traditional Irish dishes to make your Tuesday extra tasty.
303613,teachers and co-workers. Check out the recipes and bake up some holiday cheer!
303614,polish off their plates.
303615,but here are a few other easy options that will make parents and kids happy.
303616,"Local Woman Hosts Intimate Luncheon for Elderly Relative"""
303617,creations; they're all loaded with flavor!
303618,a quick riff on spinach and ricotta cannelloni. Instead of stuffing pasta shells with the
303619,Be concise and objective.
303620,"or no cooking, and are a great way to enjoy all the colorful produce that's in season."
303621,"marks the unofficial start of summer and grilling season, so no better way to celebrate than a backyard BBQ."
303622,"line: ""Vegetarian Main Course Serves as Satisfying Option for Dinner"""
303623,. They're sure to become your go-to favorites of the summer!
303624,factual news headline for the following article. Be concise and objective.
303625,"are best served warm out of the oven. As a bonus, the addition"
303626,Thai Chicken Dish Gains Popularity for Its Unique Sauce
303627,"Refreshing Summer Drinks to Beat the Heat"""
303628,"dip, especially served warm out of the oven, but a good one is hard to come by."
303629,that you crave.
303630,": ""Local Woman Reflects on Frequency of Romantic Dinners at Home"
303631,article. Be concise and objective.
303632,the following article. Be concise and objective.
303633,delicious to wake up to.
303634,challah french toast.
303635,"made mostly ahead of time, so you can enjoy a stress-free, happy Thanksgiving!"
303636,pesto is the perfect way to add pizzazz to any dish.
303637,Quick Bread Recipe Combines Chocolate and Zucchini for a Healthy Afternoon Snack
303638,heavy cream (a lot of it!) and grated cheese and then baking until
303639,are incredibly easy.
303640,Thai green curry paste and coconut milk — you’re never more than 25 minutes
303641,"mallowy center and crisp outer shell, usually topped with whipped cream and"
303642,. Be concise and objective.
303643,"Fall-themed Breakfast Recipes Feature Seasonal Ingredients"""
303644,"line: ""New Year's Eve Entertaining Ideas Focus on Finger Foods"
303645,", these easy breakfast breads will brighten even the coldest and darkest winter mornings."
303646,that make the most of fresh spring fruits and vegetables.
303647,.
303648,should be our aim.
303649,Parents Report Feeling Disconnected in Daily Interactions with Children
303650,"out how to pace our students, exposing them to measured amounts of possessions and appropriate experiences as they mature."
303651,attached to genuinely preparing young adults for the world into which they will soon graduate.
303652,exist an underlying confusion about what letting go is.
303653,"to re-tool, re-work and re-think itself, its purpose and its obligations. 10. Military personnel to come"
303654,for no other reason than to see what is there.
303655,"Write a neutral, factual news headline for the following article. Be concise and objective."
303656,"as a cultural anthropologist in Papua New Guinea (PNG), but none as unfamiliar as politicians urging people to vote for their opponents."
303657,for the following article. Be concise and objective.
303658,",” Trump said. “And if I said them, he’d never be elected again.”"
303659,"the western skies, or perhaps it will. I simply do not know."
303660,ongoing struggle against a backdrop of powerful foreign interests.
303661,Study Suggests Breast Biopsy Interpretation May Not Be 100% Accurate
303662,inations.
303663,"calorie is a calorie just as a gallon is a gallon. But fuels vary, and engines vary -- and they matter, too."
303664,"Navigating the Risks of Public Opinion"""
303665,but there is one way we know of to make it seem like winter is over: Mix up a tasty summery cocktail.
303666,"been able to get to the bottom of nine common spirits myths and what we've found is, to be honest, quite mind-blowing."
303667,"Write a neutral, factual news headline for the following article. Be concise and objective."
303668,"bed or elaborate spa treatments for your wife or mom, there's one thing she definitely deserves this Sunday: a well-made drink."
303669,"Write a neutral, factual news headline for the following article. Be concise and objective."
303670,) type of morning concoction: a brunch cocktail.
303671,the full spectrum of the fiery fruits.
303672,to need to get behind the bar and fix some cocktails.
303673,"Brandy Alexander Cocktail Originates from Pre-Prohibition Era"""
303674,one of the most popular spirits on planet Earth right now.
303675,"Rye Whiskey Sees Increased Popularity Amid Growing Interest in Craft Spirits"""
303676,"""Bourbon Cocktail Named After LA Diner Featured in San Francisco Video"""
303677,the following article. Be concise and objective.
303678,15 aw-inspiring watering holes.
303679,"(Think electricity, sriracha and tobacco.)"
303680,and objective.
303681,"have a drink for you to try. The Becharita is just as simple to make as its famous cousin, but its flavor is far more exotic."
303682,"Write a neutral, factual news headline for the following article. Be concise and objective."
303683,"Write a neutral, factual news headline for the following article. Be concise and objective."
303684,"Write a neutral, factual news headline for the following article. Be concise and objective."
